{
  "schema": "dreamco.data_package_synthesis_asset.v1",
  "asset_id": "edu-goam-01.0604",
  "title": "Study plan: Greenhouse Operations and Management (CIP 01.0604)",
  "capability_ids": [
    "career-pathway-study-plan"
  ],
  "perspectives_used": [
    "official_documentation"
  ],
  "source_refs": [
    {
      "source_id": "onet_db_31_0",
      "version": "31.0",
      "pinned_by": "provenance.json#sources",
      "perspective": "official_documentation"
    },
    {
      "source_id": "onet_db_31_0_jobzones_tasks",
      "version": "31.0",
      "pinned_by": "provenance.json#sources",
      "perspective": "official_documentation"
    },
    {
      "source_id": "onet_cip_soc_crosswalk",
      "version": "CIP 2020 to O*NET-SOC 2019 (sha256-pinned; the file states no revision date)",
      "pinned_by": "provenance.json#sources",
      "perspective": "official_documentation"
    }
  ],
  "ownership_class": "open_license_with_conditions",
  "commercial_redistribution_allowed": true,
  "attribution_required": true,
  "share_alike_required": false,
  "human_layer": {
    "path": "study_plans/01.0604_greenhouse_operations_and_management.md",
    "format": "markdown",
    "sha256": "553623a93ce5e7762044a355f1220d249c201bf1f30b642bc691309d2016804e",
    "elements": [
      "linked occupations with Job Zones",
      "key knowledge areas",
      "key Essential Skills",
      "entry-level targets (rule output, not reviewed)",
      "4-year outline (element names only)",
      "typical next steps",
      "template practice exercises quoting O*NET task statements"
    ]
  },
  "machine_layer": {
    "path": "study_plans/01.0604_greenhouse_operations_and_management/plan.json",
    "format": "json",
    "sha256": "d7362d121d378045a5e77ee051f3c74567a4579d09a71fe258f170ae13023666",
    "elements": [
      "tier",
      "occupations",
      "top_knowledge",
      "top_skills",
      "entry_targets",
      "entry_target_review",
      "practice_tasks",
      "rubrics",
      "reference_answer_outlines"
    ]
  },
  "dreamco_analysis": {
    "agree": [
      "All 5 crosswalk links for CIP 01.0604 resolve to O*NET 31.0 occupation codes (tests check this).",
      "Entry targets are O*NET Job Zone 1-2 linked occupations: Landscaping and Groundskeeping Workers.",
      "Tier generated: entry targets are the unreviewed rule output; nobody checked them for plausibility."
    ],
    "reject": [
      "Not used as entry targets (leadership, faculty, or residual titles): Farmers, Ranchers, and Other Agricultural Managers; Agricultural Sciences Teachers, Postsecondary; First-Line Supervisors of Landscaping, Lawn Service, and Groundskeeping Workers; First-Line Supervisors of Farming, Fishing, and Forestry Workers."
    ],
    "improve": [
      "Knowledge and skill importance used for the outline is an entry-weighted mean (targets weight 2, other Job Zone-appropriate non-leadership linked roles weight 1); the weights are a DreamCo heuristic, not an O*NET method, and the unweighted all-linked list is shown for comparison.",
      "Generated tier: the outline lists O*NET element names without course topics, and practice exercises share one template; authoring this major would replace both."
    ],
    "still_need_test": [
      "Practice exercises are one fixed template around quoted O*NET task statements; they were not individually authored, reviewed, or piloted with learners.",
      "No sandbox, benchmark or holdout evaluation exists: this box has no independent model API key or human graders, and a self-graded run would not be independent evidence.",
      "DreamCo-original text has not had owner review.",
      "No regression evidence exists for generated-tier plans: they are new in this release, so there is no previous release to compare against."
    ]
  },
  "validation_evidence_ids": {
    "sandbox": [],
    "benchmark": [],
    "holdout": [],
    "regression": []
  },
  "integrity_hash": "sha256:553623a93ce5e7762044a355f1220d249c201bf1f30b642bc691309d2016804e",
  "created_at": "2026-10-02T18:30:00-05:00",
  "evidence_root": "study_packs/career_pathways/data/dreamco_knowledge/evidence",
  "generator_version": "edu-career-pathways build.py sha256:ac00278afc387f974fac0cb1fd5e1e25176cf89627c0409ef72d73319f28e3fd",
  "notes": [
    "dreamco_analysis is generated by build.py from build facts and the authored review files; it is not a human review.",
    "tier: generated (see plan.json and data/majors_selected.json).",
    "validation_evidence_ids: only regression evidence (if listed) exists. sandbox and benchmark are empty on purpose; holdout stays empty until the owner grades evidence/holdout_kit; evidence/pytest.txt is a build-integrity run and is not counted.",
    "evidence is append-only: records for earlier versions of this asset stay linked; the ones whose source_reference is this version's integrity_hash are: none",
    "perspectives_used has one entry: O*NET and the crosswalk are both official USDOL/ETA sources (closest policy perspective: official_documentation)."
  ]
}
