{
  "schema": "dreamco.data_package_synthesis_asset.v1",
  "asset_id": "edu-caac-50.0711",
  "title": "Study plan: Ceramic Arts and Ceramics (CIP 50.0711)",
  "capability_ids": [
    "career-pathway-study-plan"
  ],
  "perspectives_used": [
    "official_documentation"
  ],
  "source_refs": [
    {
      "source_id": "onet_db_31_0",
      "version": "31.0",
      "pinned_by": "provenance.json#sources",
      "perspective": "official_documentation"
    },
    {
      "source_id": "onet_db_31_0_jobzones_tasks",
      "version": "31.0",
      "pinned_by": "provenance.json#sources",
      "perspective": "official_documentation"
    },
    {
      "source_id": "onet_cip_soc_crosswalk",
      "version": "CIP 2020 to O*NET-SOC 2019 (sha256-pinned; the file states no revision date)",
      "pinned_by": "provenance.json#sources",
      "perspective": "official_documentation"
    }
  ],
  "ownership_class": "open_license_with_conditions",
  "commercial_redistribution_allowed": true,
  "attribution_required": true,
  "share_alike_required": false,
  "human_layer": {
    "path": "study_plans/50.0711_ceramic_arts_and_ceramics.md",
    "format": "markdown",
    "sha256": "31fe4f7e7b5144caa6af47fc297076bc58f12b55ab6002cad2ef37c5f7827c64",
    "elements": [
      "linked occupations with Job Zones",
      "key knowledge areas",
      "key Essential Skills",
      "entry-level targets (rule output, not reviewed)",
      "4-year outline (element names only)",
      "typical next steps",
      "template practice exercises quoting O*NET task statements"
    ]
  },
  "machine_layer": {
    "path": "study_plans/50.0711_ceramic_arts_and_ceramics/plan.json",
    "format": "json",
    "sha256": "5546b1f572838e26a6802037fd5f7a17cd75dab3f56e189752e94b9ad1fb27be",
    "elements": [
      "tier",
      "occupations",
      "top_knowledge",
      "top_skills",
      "entry_targets",
      "entry_target_review",
      "practice_tasks",
      "rubrics",
      "reference_answer_outlines"
    ]
  },
  "dreamco_analysis": {
    "agree": [
      "All 3 crosswalk links for CIP 50.0711 resolve to O*NET 31.0 occupation codes (tests check this).",
      "Entry targets are O*NET Job Zone 3 linked occupations: Fine Artists, Including Painters, Sculptors, and Illustrators; Craft Artists.",
      "Tier generated: entry targets are the unreviewed rule output; nobody checked them for plausibility."
    ],
    "reject": [
      "Not used as entry targets (leadership, faculty, or residual titles): Art, Drama, and Music Teachers, Postsecondary."
    ],
    "improve": [
      "Knowledge and skill importance used for the outline is an entry-weighted mean (targets weight 2, other Job Zone-appropriate non-leadership linked roles weight 1); the weights are a DreamCo heuristic, not an O*NET method, and the unweighted all-linked list is shown for comparison.",
      "Generated tier: the outline lists O*NET element names without course topics, and practice exercises share one template; authoring this major would replace both."
    ],
    "still_need_test": [
      "Practice exercises are one fixed template around quoted O*NET task statements; they were not individually authored, reviewed, or piloted with learners.",
      "No sandbox, benchmark or holdout evaluation exists: this box has no independent model API key or human graders, and a self-graded run would not be independent evidence.",
      "DreamCo-original text has not had owner review.",
      "No regression evidence exists for generated-tier plans: they are new in this release, so there is no previous release to compare against."
    ]
  },
  "validation_evidence_ids": {
    "sandbox": [],
    "benchmark": [],
    "holdout": [],
    "regression": []
  },
  "integrity_hash": "sha256:31fe4f7e7b5144caa6af47fc297076bc58f12b55ab6002cad2ef37c5f7827c64",
  "created_at": "2026-10-02T18:30:00-05:00",
  "evidence_root": "study_packs/career_pathways/data/dreamco_knowledge/evidence",
  "generator_version": "edu-career-pathways build.py sha256:2a01ee18444b4b66ba05821c646979920630bc06b950254b256682521e76b0a9",
  "notes": [
    "dreamco_analysis is generated by build.py from build facts and the authored review files; it is not a human review.",
    "tier: generated (see plan.json and data/majors_selected.json).",
    "validation_evidence_ids: only regression evidence (if listed) exists. sandbox, benchmark and holdout are empty on purpose; evidence/pytest.txt is a build-integrity run and is not counted.",
    "perspectives_used has one entry: O*NET and the crosswalk are both official USDOL/ETA sources (closest policy perspective: official_documentation)."
  ]
}
